[
  {
    "graph_id": "eth.market.v1",
    "updated_at": "2026-06-04T09:00:00Z",
    "nodes": [
      { "node_id": "user_117", "node_type": "user" },
      { "node_id": "Polymarket", "node_type": "protocol" },
      { "node_id": "PM_ETH_5K", "node_type": "market" },
      { "node_id": "KAL_ETH_5K", "node_type": "market" },
      { "node_id": "PM_ETH_6K", "node_type": "market" },
      { "node_id": "PM_BTC_100K", "node_type": "market" },
      { "node_id": "TRD_001", "node_type": "trade" },
      { "node_id": "OUT_YES_SHARES", "node_type": "outcome" },
      { "node_id": "FB_OPEN", "node_type": "feedback" }
    ],
    "edges": [
      { "source": "user_117", "target": "Polymarket" },
      { "source": "Polymarket", "target": "PM_ETH_5K", "metadata": { "source_url": "https://polymarket.com", "confidence_score": 1.0 } },
      { "source": "PM_ETH_5K", "target": "TRD_001", "Action": "Buy YES", "metadata": { "thesis": "Layer-1 gas burning patterns are accelerating, indicating strong structural upside velocity before weekly options expiry.", "conviction_level": 9, "tags": ["#eth", "#momentum", "#gas_burn"], "source_url": "https://polygonscan.com/tx/001", "confidence_score": 1.0, "timestamp": "2026-06-04T08:55:00Z" } },
      { "source": "TRD_001", "target": "OUT_YES_SHARES", "metadata": { "source_url": "https://etherscan.io" } },
      { "source": "TRD_001", "target": "FB_OPEN", "metadata": { "source_url": "https://etherscan.io" } },
      { "source": "PM_ETH_5K", "targets": ["KAL_ETH_5K", "PM_ETH_6K", "PM_BTC_100K"], "direction": "bi-directional", "metadata": { "relationship_type": "correlated_market" } }
    ]
  },
  {
    "graph_id": "eth.market.v1",
    "updated_at": "2026-06-04T09:15:00Z",
    "nodes": [
      { "node_id": "user_117", "node_type": "user" },
      { "node_id": "Kalshi", "node_type": "protocol" },
      { "node_id": "KAL_BTC_100K", "node_type": "market" },
      { "node_id": "PM_BTC_100K", "node_type": "market" },
      { "node_id": "TRD_002", "node_type": "trade" },
      { "node_id": "OUT_NO_CONTRACTS", "node_type": "outcome" },
      { "node_id": "FB_OPEN", "node_type": "feedback" }
    ],
    "edges": [
      { "source": "user_117", "target": "Kalshi" },
      { "source": "Kalshi", "target": "KAL_BTC_100K", "metadata": { "source_url": "https://kalshi.com", "confidence_score": 1.0 } },
      { "source": "KAL_BTC_100K", "target": "TRD_002", "Action": "Buy NO", "metadata": { "thesis": "Massive institutional sell walls detected at $99.5k. Unlikely to breach without a fresh weekend macro catalyst.", "conviction_level": 7, "tags": ["#btc", "#resistance", "#order_book"], "source_url": "https://kalshi.com/tx/002", "confidence_score": 1.0, "timestamp": "2026-06-04T09:11:00Z" } },
      { "source": "TRD_002", "target": "OUT_NO_CONTRACTS", "metadata": { "source_url": "https://kalshi.com" } },
      { "source": "TRD_002", "target": "FB_OPEN", "metadata": { "source_url": "https://kalshi.com" } },
      { "source": "KAL_BTC_100K", "targets": ["PM_BTC_100K"], "direction": "bi-directional", "metadata": { "relationship_type": "correlated_market" } }
    ]
  },
  {
    "graph_id": "eth.market.v1",
    "updated_at": "2026-06-04T09:30:00Z",
    "nodes": [
      { "node_id": "user_117", "node_type": "user" },
      { "node_id": "Polymarket", "node_type": "protocol" },
      { "node_id": "PM_ETH_5K", "node_type": "market" },
      { "node_id": "KAL_ETH_5K", "node_type": "market" },
      { "node_id": "PM_ETH_4K", "node_type": "market" },
      { "node_id": "TRD_003", "node_type": "trade" },
      { "node_id": "OUT_REDUCED_SHARES", "node_type": "outcome" },
      { "node_id": "FB_CLOSED_PROFIT", "node_type": "feedback" }
    ],
    "edges": [
      { "source": "user_117", "target": "Polymarket" },
      { "source": "Polymarket", "target": "PM_ETH_5K", "metadata": { "source_url": "https://polymarket.com", "confidence_score": 1.0 } },
      { "source": "PM_ETH_5K", "target": "TRD_003", "Action": "Sell YES", "metadata": { "thesis": "Momentum targets unlocked early. Securing safe profits prior to the volatile afternoon federal budget address.", "conviction_level": 8, "tags": ["#eth", "#take_profit", "#macro_risk"], "source_url": "https://polygonscan.com/tx/003", "confidence_score": 1.0, "timestamp": "2026-06-04T09:26:00Z" } },
      { "source": "TRD_003", "target": "OUT_REDUCED_SHARES", "metadata": { "source_url": "https://etherscan.io" } },
      { "source": "TRD_003", "target": "FB_CLOSED_PROFIT", "metadata": { "source_url": "https://etherscan.io" } },
      { "source": "PM_ETH_5K", "targets": ["KAL_ETH_5K", "PM_ETH_4K"], "direction": "bi-directional", "metadata": { "relationship_type": "correlated_market" } }
    ]
  },
  {
    "graph_id": "eth.market.v1",
    "updated_at": "2026-06-04T09:50:00Z",
    "nodes": [
      { "node_id": "user_117", "node_type": "user" },
      { "node_id": "Polymarket", "node_type": "protocol" },
      { "node_id": "PM_SOL_200", "node_type": "market" },
      { "node_id": "KAL_SOL_200", "node_type": "market" },
      { "node_id": "PM_SOL_250", "node_type": "market" },
      { "node_id": "TRD_004", "node_type": "trade" },
      { "node_id": "OUT_YES_SHARES", "node_type": "outcome" },
      { "node_id": "FB_OPEN", "node_type": "feedback" }
    ],
    "edges": [
      { "source": "user_117", "target": "Polymarket" },
      { "source": "Polymarket", "target": "PM_SOL_200", "metadata": { "source_url": "https://polymarket.com", "confidence_score": 1.0 } },
      { "source": "PM_SOL_200", "target": "TRD_004", "Action": "Buy YES", "metadata": { "thesis": "On-chain DEX activity metrics are spiking aggressively, highlighting deep market underpricing of Solana ecosystem volume.", "conviction_level": 8, "tags": ["#sol", "#onchain_volume", "#dex_metrics"], "source_url": "https://solscan.io/tx/004", "confidence_score": 1.0, "timestamp": "2026-06-04T09:44:00Z" } },
      { "source": "TRD_004", "target": "OUT_YES_SHARES", "metadata": { "source_url": "https://solscan.io" } },
      { "source": "TRD_004", "target": "FB_OPEN", "metadata": { "source_url": "https://solscan.io" } },
      { "source": "PM_SOL_200", "targets": ["KAL_SOL_200", "PM_SOL_250"], "direction": "bi-directional", "metadata": { "relationship_type": "correlated_market" } }
    ]
  },
  {
    "graph_id": "eth.market.v1",
    "updated_at": "2026-06-04T10:05:00Z",
    "nodes": [
      { "node_id": "user_117", "node_type": "user" },
      { "node_id": "Polymarket", "node_type": "protocol" },
      { "node_id": "PM_SOL_200", "node_type": "market" },
      { "node_id": "KAL_SOL_200", "node_type": "market" },
      { "node_id": "TRD_005", "node_type": "trade" },
      { "node_id": "OUT_LIQUIDATED", "node_type": "outcome" },
      { "node_id": "FB_CLOSED_LOSS", "node_type": "feedback" }
    ],
    "edges": [
      { "source": "user_117", "target": "Polymarket" },
      { "source": "Polymarket", "target": "PM_SOL_200", "metadata": { "source_url": "https://polymarket.com", "confidence_score": 1.0 } },
      { "source": "PM_SOL_200", "target": "TRD_005", "Action": "Sell YES", "metadata": { "thesis": "Mainnet RPC service degradation triggered panic selling. Exiting position early to maintain absolute asset protection standards.", "conviction_level": 7, "tags": ["#sol", "#stop_loss", "#rpc_outage"], "source_url": "https://solscan.io/tx/005", "confidence_score": 1.0, "timestamp": "2026-06-04T10:01:00Z" } },
      { "source": "TRD_005", "target": "OUT_LIQUIDATED", "metadata": { "source_url": "https://solscan.io" } },
      { "source": "TRD_005", "target": "FB_CLOSED_LOSS", "metadata": { "source_url": "https://solscan.io" } },
      { "source": "PM_SOL_200", "targets": ["KAL_SOL_200"], "direction": "bi-directional", "metadata": { "relationship_type": "correlated_market" } }
    ]
  },
  {
    "graph_id": "eth.market.v1",
    "updated_at": "2026-06-04T10:25:00Z",
    "nodes": [
      { "node_id": "user_117", "node_type": "user" },
      { "node_id": "Kalshi", "node_type": "protocol" },
      { "node_id": "KAL_FED_RATE", "node_type": "market" },
      { "node_id": "PM_FED_RATE", "node_type": "market" },
      { "node_id": "CME_FEDWATCH", "node_type": "market" },
      { "node_id": "TRD_006", "node_type": "trade" },
      { "node_id": "OUT_NO_CONTRACTS", "node_type": "outcome" },
      { "node_id": "FB_OPEN", "node_type": "feedback" }
    ],
    "edges": [
      { "source": "user_117", "target": "Kalshi" },
      { "source": "Kalshi", "target": "KAL_FED_RATE", "metadata": { "source_url": "https://kalshi.com", "confidence_score": 1.0 } },
      { "source": "KAL_FED_RATE", "target": "TRD_006", "Action": "Buy NO", "metadata": { "thesis": "Recent hawkish central bank commentary entirely nullifies the likelihood of consecutive rate reductions this period.", "conviction_level": 10, "tags": ["#macro", "#fed", "#interest_rates"], "source_url": "https://kalshi.com/tx/006", "confidence_score": 1.0, "timestamp": "2026-06-04T10:20:00Z" } },
      { "source": "TRD_006", "target": "OUT_NO_CONTRACTS", "metadata": { "source_url": "https://kalshi.com" } },
      { "source": "TRD_006", "target": "FB_OPEN", "metadata": { "source_url": "https://kalshi.com" } },
      { "source": "KAL_FED_RATE", "targets": ["PM_FED_RATE", "CME_FEDWATCH"], "direction": "bi-directional", "metadata": { "relationship_type": "correlated_market" } }
    ]
  },
  {
    "graph_id": "eth.market.v1",
    "updated_at": "2026-06-04T10:40:00Z",
    "nodes": [
      { "node_id": "user_117", "node_type": "user" },
      { "node_id": "Kalshi", "node_type": "protocol" },
      { "node_id": "KAL_FED_RATE", "node_type": "market" },
      { "node_id": "PM_FED_RATE", "node_type": "market" },
      { "node_id": "TRD_007", "node_type": "trade" },
      { "node_id": "OUT_CLOSED_CONTRACTS", "node_type": "outcome" },
      { "node_id": "FB_CLOSED_PROFIT", "node_type": "feedback" }
    ],
    "edges": [
      { "source": "user_117", "target": "Kalshi" },